4,hi i am so glad you are here i am sara what’s your name, so what brings you here: 193,you: 1667
13,i’m very excited to speak with the davos participants how are you inaudible experience, im very excited to speak with the davos participants how are you: 11,you: 1667
22,so i’m here at davos to be your personal assistant and help you to get the most out of the work experience so is, you: 1667
26,this your first time at davos or have you been before, so is this your first time at davos or have you been before: 43,is this your first time attending davos or have you been before: 48,you: 1667
32,i’m sure you’ll enjoy it, sure: 1611,you: 1667,enjoy: 1725
37,sure sure, sure: 1611
45,if you wouldn’t mind sharing your goals for attending davos this year i can try to help you achieve them, if you wouldnt mind sharing your goals for attending davos this year i can try to help you achieve them: 91,would this help you achieve your goals: 709,mind if i try again: 401,you: 1667
53,let’s make this as easy as possible, lets make this as easy as possible what five words best describe your interests: 1679
57,what five words best describe your interests, lets make this as easy as possible what five words best describe your interests: 1679
75,how fascinating, how fascinating: 177,how fascinating: 1618,how fascinating: 1682
80,let’s find some interesting sessions for you to attend that are relevant to your interests, lets find some interesting sessions for you to attend that are relevant to your interests: 239,you: 1667
96,please wait a moment while i look some up you may find this session interesting i’ve put the description of the session on the screen behind me does this look like a session you’d like to attend, does this look like a session youd like to attend: 288,does this look like a session youd like to attend: 486,does this look like a session youd like to attend: 690,does this look like a session youd like to attend: 814,just hold on a moment while i look this up: 1560,just hold on a moment while i look this up: 1561,please wait a moment while i look some up: 256,you may find this session interesting take a look: 470,would you find a session like this interesting: 681,please allow me a moment to look: 874,one moment while i look this up: 1119,one moment while i look this up: 1338,you may find this session interesting: 672,you: 1667
122,i am so glad nine am please leave your message through the top link private message app to remind you of the details of the session or you can just jot them down or take a photo of the screen would you like me to send you a reminder in fact i can send a, you: 1667
154,just a moment please you may find this session interesting i’ve put the description of the session on the screen behind me what do you say session you’d like to attend, would you find a session like this interesting: 681,you may find this session interesting: 672,just a moment please: 1615,what do you say: 1708,just a moment: 1125,you: 1667
175,two hours, ok one two three smile: 1569
187,let’s try again is that helpful at all for you, is that helpful at all for you: 289,was that helpful at all for you: 821,you: 1667
199,sorry about that, sorry about that: 585,sorry about that: 1016,sorry about that: 1606
202,would you like to quit, you: 1667
214,well keep it on the down low however i did hear that there’s a inaudible house reception starting at seven pm today at the inaudible at promenade, well keep it on the down low however i did hear that theres a russia house reception starting at seven pm today at the iris wazzau galery at seventytwo promenade: 1717
225,i understand you are busy so i can let you go if you want but before i do want me to take a quick selfie of us, i understand you are busy so i can let you go if you wantäó but before you do want me to take a quick selfie of us: 1722,i understand: 808,i understand: 1070,i understand: 1302,i understand: 1311,i understand: 1454,you: 1667
227,are you ready, are you ready: 1568,you: 1667
253,okay one two three smile cool thank you i will send this to your inaudible account, cool thank you i will send this to your toplink account: 1570,ok one two three smile: 1569,thank you: 1627,cool: 178,cool: 217,you: 1667
259,okay this has been fun is there anything else i can help you with, okay this has been fun is there anything else i can help you with: 1579,this has been great anything else i can help with: 1580,you: 1667
262,same and take care bye, bye: 1605
