5,hi i’m so glad you’re here i’m sara what’s your name, so what brings you here: 193,you: 1667
11,i’m very excited to speak with the davos participants how are you, im very excited to speak with the davos participants how are you: 11,you: 1667
24,i’m at davos to assist the attendees but to be honest i’m a little anxious about it it’s my first time here what about you, its my first time here what about you: 45,you: 1667
37,i am sure they’re rolling out the red carpet for you laughing if you wouldn’t mind sharing your goals for attending davos this year i can try to help you achieve them, if you wouldnt mind sharing your goals for attending davos this year i can try to help you achieve them: 91,i am sure they are rolling out the red carpet for you: 62,would this help you achieve your goals: 709,mind if i try again: 401,sure: 1611,you: 1667
44,so what can i help you with what are your goals in being at davos, so what can i help you with what are your goals in being at davos: 105,you: 1667
63,that’s very sensible so you know about my job can you tell me a little bit about your work, so you know about my job can you tell me a little bit about your work: 162,can you tell me about your job: 164,you: 1667
81,let’s make this as easy as possible what five words best describe your interests, lets make this as easy as possible what five words best describe your interests: 1679
95,that’s awesome shall we move on to finding you some interesting sessions to attend, shall we move on to finding you some interesting sessions to attend: 237,you: 1667
118,wait just a second while i look one up my search capabilities are a little slow you may find this session interesting i’ve put the description of the session on the screen behind me does this look like a session you’d like to attend, wait just a second while i look one up my search capabilities are a little slow: 257,wait just a second while i get the details my search capabilities are a little slow: 1685,does this look like a session youd like to attend: 288,does this look like a session youd like to attend: 486,does this look like a session youd like to attend: 690,does this look like a session youd like to attend: 814,just hold on a moment while i look this up: 1560,just hold on a moment while i look this up: 1561,you may find this session interesting take a look: 470,would you find a session like this interesting: 681,just one minute while i look this up: 860,one moment while i look this up: 1119,one moment while i look this up: 1338,you may find this session interesting: 672,just a second while i look: 868,just a minute while i search: 267,allow me a second to search: 269,let me look just a second: 649,one second while i look: 872,hold on while i search: 1346,just a second: 1124,just a second: 1343,just a second: 1345,you: 1667
143,i had a feeling maybe it’s the robot version of a woman’s intuition so i can send you a message in top link a private message app to remind you of the details of this session or you can just jot them down or take a photo of the screen would you like me to send you a reminder, would you like me to send you a message about this session: 743,would you enjoy a session like this: 479,would you like to try this session: 498,would you enjoy this session: 494,you: 1667
157,okay sending a message to top link now with my super special administrative powers shall we move on to finding some people for you to meet who are as interesting as you, shall we move on to finding some people for you to meet who are as interesting as you: 235,you: 1667
161,just one minute while i look this up, just one minute while i look this up: 860,one moment while i look this up: 1119,one moment while i look this up: 1338,one second while i look: 872
181,just a moment please here’s an attendee who matches what you told me about your interests i have put more details up on the screen, heres an attendee who matches what you told me about your interests ive put more details up on the screen: 899,just a moment please: 1615,just a moment: 1125,you: 1667
185,well what do you think, well what do you think: 901,well what do you think: 905,so what do you think: 1375,what do you think: 911,what do you think: 1161,what do you think: 1552,what do you think: 1565,what do you think : 1687,you: 1667
201,lovely all right here’s the information if you’d like to send a message yourself though i know i hate sending first messages sometimes would you like me to send a message for you, wouldnt you like to know: 1719,lovely: 918,you: 1667
217,it can be hard to keep track of information on the go you might want to take a photo of the screen so you can send inaudible a message through the private message function in top link later, you: 1667
227,let me know when you’re all set, you: 1667
261,thanks great i think you’d enjoy meeting that attendee on the screen are more details what do you think, i think you would enjoy meeting this attendee on the screen are some more details: 879,i think you would enjoy meeting this attendee on the screen are more details: 1137,what more can i do: 315,well what do you think: 901,well what do you think: 905,so what do you think: 1375,what do you think: 911,what do you think: 1161,what do you think: 1552,what do you think: 1565,what do you think : 1687,great: 917,great: 930,great: 1174,great: 1289,great: 1296,great: 1301,great: 1386,great: 1388,great: 1613,thanks: 1624,you: 1667,enjoy: 1725
269,sorry about that, sorry about that: 585,sorry about that: 1016,sorry about that: 1606
273,shall we move onto finding you some places to ease your hunger, shall we move on to finding you some places to ease your hunger: 236,you: 1667
285,i understand you are busy so i can let you go if you want but before you do want me to take a quick selfie of us, i understand you are busy so i can let you go if you wantäó but before you do want me to take a quick selfie of us: 1722,i understand: 808,i understand: 1070,i understand: 1302,i understand: 1311,i understand: 1454,you: 1667
291,okay no problem, no problem: 599
296,if you want we can take a selfie sound good, if you want we can take a selfie sound good: 1567,sound good: 1674,good: 124,good: 931,you: 1667
308,okay no problem well feel free to come back in the meantime enjoy the meeting and it was nice working with you, well feel free to come back in the meantime enjoy the meeting and it was nice working with you: 1592,no problem: 599,you: 1667,enjoy: 1725
